{
  "schema_version": "0.1-draft",
  "fictional": true,
  "decision_id": "fictional-maintainer-decision-001",
  "proposal_id": "fictional-coordination-proposal",
  "target_commit": "aaaaaaaaaaaaaaaaaaaaaaaaaaaaaaaaaaaaaaaa",
  "change_class": "normative",
  "route": "maintainer_adoption",
  "stage": "maintainer_led",
  "outcome": "accepted",
  "adoption_label": "maintainer_reference",
  "scope": "Hypothetical adoption of a coordination interface as a maintainer reference only.",
  "participants_covered": ["fictional-maintainer"],
  "author": {"actor_id": "fictional-maintainer", "control_domain": "fictional-maintainer-domain", "mandate_ref": "Fictional repository maintenance role"},
  "facilitator": {"actor_id": "fictional-maintainer", "control_domain": "fictional-maintainer-domain", "mandate_ref": "Disclosed bootstrap self-decision, not community facilitation"},
  "policy_ref": "Fictional example under the proposed RATIFICATION.md; no actual adoption is asserted.",
  "roster_ref": null,
  "opened_at": "2026-10-01",
  "decided_at": "2026-10-16",
  "review_statement_ids": ["fictional-position-001"],
  "ratifier_statement_ids": [],
  "objections": [{"statement_id": "fictional-position-001", "disposition": "answered", "rationale": "Confirmation, consent, and authority are explicitly distinguished in the hypothetical candidate.", "response_ref": "CONTEXT_ALIGNMENT.md"}],
  "rationale": "This is a demonstration of a labelled founder decision with common-control review, not independent or mixed-community approval.",
  "appeal_route": "Fictional public issue; no independent body has been constituted.",
  "next_review": "2027-01-16"
}
